premium,name,department,has_test,response_letter_required,area,address,employer,snippet,schedule,working_time_intervals,accept_temporary,professional_roles,experience,employment,key_skills,average_salary,min_salary,max_salary,hours_since_publication
False,ML Data Scientist (Middle),,False,False,Москва,,Гибрид,"{'requirement': 'д.). Опыт работы с DL (PyTorch/ TensorFlow) и <highlighttext>ML</highlighttext> библиотеками (Scikit-Learn, river). Знание SQL. Знания линейной алгебры, теории вероятностей...', 'responsibility': 'Разработка <highlighttext>ML</highlighttext> решений для оптимизации рекламных кампаний. Тестирование гипотез. Оценка качества моделей. Поддержка и улучшение текущей <highlighttext>ML</highlighttext>-инфраструктуры. '}",Удаленная работа,,False,Аналитик,От 1 года до 3 лет,Полная занятость,[],,,,29
False,Архитектор ML-решений,ГК Иннотех | Финтех (Иннотех),False,False,Москва,,Т1,"{'requirement': 'Будет плюсом: Хорошее знание стека Hadoop (Spark, Hive, Yarn). Опыт работы с <highlighttext>ML</highlighttext> со стороны Data Science/Data Engineers. ', 'responsibility': 'Оценка текущей архитектуры + выработка рекомендаций и предложений по улучшению. Разработка, описание и защита архитектурных решений в рамках проектов. '}",Удаленная работа,,False,Технический директор (CTO),От 3 до 6 лет,Полная занятость,[],,,,489
False,Middle разработчик ML,,False,False,Москва,,Корпорация ЭЛАР,"{'requirement': 'Понимание процессов MLOps, составляющих элементов жизненного цикла моделей машинного обучения и нейронных сетей. Знание основных алгоритмов машинного и глубокого обучения...', 'responsibility': 'Участие в проекте по созданию систем интеллектуального анализа и распознавания документов (Document AI). Разработка сервисов классификации и потоковой сегментации документов. '}",Удаленная работа,,False,"Программист, разработчик",От 1 года до 3 лет,Полная занятость,"['Python', 'Искусственный интеллект', 'SQL Alchemy']",,,,125
False,Data Scientist (senior),,False,False,Москва,,Бюро судебного взыскания,"{'requirement': 'опыт работы от 3 лет. - знание общей инфраструктуры (git, jupyter, docker). - хорошее знание Python и основных пакетов для анализа данных...', 'responsibility': '...использования в <highlighttext>ML</highlighttext>-моделях, проводить тщательный анализ данных (EDA). Разработка и тестирование моделей: построение, оценка и тестирование <highlighttext>ml</highlighttext> моделей. '}",Удаленная работа,,False,Дата-сайентист,От 3 до 6 лет,Полная занятость,[],350000.0,300000.0,400000.0,633
False,Machine learning Engineer / ML Engineer,,False,False,Нижний Новгород,,Neuro.net,"{'requirement': 'Понимание принципов работы систем ASR, TTS, NLP. Понимание архитектур (CNN, RNN, LSTM, GRU, Transformers и т.д.). Опыт написания производительного...', 'responsibility': 'Доработка существующих сервисов ASR, TTS, NLP: оптимизация производительности, добавление нового функционала. Написание новых сервисов в рамках существующей микросервисной архитектуры.'}",Удаленная работа,,False,Дата-сайентист,От 3 до 6 лет,Полная занятость,"['Triton', 'Python', 'PyTorch', 'Git']",,,,628
False,ML-инженер,,False,False,Уфа,,Т-Банк,"{'requirement': 'Опыт разработки моделей машинного обучения с использованием современных DL фреймворков (Tensorflow, Pytorch, Keras, etc) и применения их в продакшене. ', 'responsibility': 'Речевые технологии. Автоматизируем голосовое общение между бизнесом и клиентами. <highlighttext>ML</highlighttext>-антифрод. С помощью алгоритмов оберегаем пользователей от мошенников, оперативно замечая...'}",Полный день,,False,"Программист, разработчик",От 3 до 6 лет,Полная занятость,[],,,,311
False,"Team Lead/архитектор (start-up, разработка продукта, Big Data)",,False,False,Москва,,Positive Technologies,"{'requirement': '...Flink <highlighttext>ML</highlighttext>). Уверенные знания SQL. Опыт работы с библиотеками для работы с данными: pandas, numpy. Опыт работы с <highlighttext>ML</highlighttext>-библиотеками...', 'responsibility': 'Разработка Продукта - аналитической системы. Определение технического стека проекта. Построение предиктивных моделей, расчет конверсии.'}",Полный день,,False,Технический директор (CTO),От 3 до 6 лет,Полная занятость,[],,,,703
False,Middle Data Analyst / Data scientist,,False,False,Москва,,КОРУС Консалтинг,"{'requirement': 'Знание библиотек визуализации данных: Matplotlib, Seaborn, Plotly. Умение применять модели <highlighttext>ML</highlighttext> для решения задач бизнеса. Знание основных метрик классификации и...', 'responsibility': 'DWH: Oracle, PostgreSQL/GreenPlum, Clickhouse. Стек Apache: Superset, Hadoop, AirFlow, Nifi, Kafka. Системы отчетности: Qlik, Luxms BI, Fine BI, Power...'}",Полный день,,False,Дата-сайентист,От 1 года до 3 лет,Полная занятость,"['Python', 'Data Analysis', 'SQL', 'pandas', 'Numpy', 'Sklearn', 'SciPy', 'Greenplum', 'PyTorch', 'Keras', 'TensorFlow', 'LightGBM', 'CatBoost']",,,,627
False,QA Automation (Python),"МегаФон, IT",False,False,Санкт-Петербург,,МегаФон,"{'requirement': 'Опыт работы в ОС Linux на уровне пользователя. Будет плюсом: Базовое понимание <highlighttext>ML</highlighttext>, тестирование моделей и методов машинного обучения.', 'responsibility': 'Деплой тестовых стендов в Kubernetes через Jenkins. Написание и выполнение автотестов на стендах. Проведение нагрузочных тестирований. Проведение регрессионного тестирования. '}",Удаленная работа,,False,Тестировщик,От 3 до 6 лет,Полная занятость,"['Python', 'Pytest', 'Docker', 'PostgreSQL', 'CI/CD']",,,,632
False,Middle+/Senior Data Scientist (модели кредитного риска),Альфа-Банк. Центральный офис,False,False,Москва,"{'city': 'Москва', 'street': 'проспект Андропова', 'building': '18к3', 'lat': 55.6945, 'lng': 37.662021, 'description': None, 'raw': 'Москва, проспект Андропова, 18к3', 'metro': {'station_name': 'Технопарк', 'line_name': 'Замоскворецкая', 'station_id': '2.512', 'line_id': '2', 'lat': 55.695, 'lng': 37.664167}, 'metro_stations': [{'station_name': 'Технопарк', 'line_name': 'Замоскворецкая', 'station_id': '2.512', 'line_id': '2', 'lat': 55.695, 'lng': 37.664167}], 'id': '602591'}",Альфа-Банк,"{'requirement': 'Умение работать с данными (анализ, очистка, подготовка, отбор и создание признаков), навыки написания SQL-запросов. Хорошее знание теории вероятностей, математической...', 'responsibility': 'Разрабатывать и поддерживать модели коллекшена: classic <highlighttext>ML</highlighttext> cls/reg/clust, Next Best Action, Propensity scoring, Uplift evaluating & learning, Active Learning...'}",Полный день,,False,Дата-сайентист,От 3 до 6 лет,Полная занятость,[],,,,27
False,TeamLead (CV),,True,False,Москва,,МКСКОМ,"{'requirement': 'С-level или тимлид в компании, которая разрабатывает проекты/продукты в области компьютерного зрения. Какие темы мы хотим обсудить: Требования...', 'responsibility': 'Какие задачи и боли клиента будет решать сервис: ⁃ укладываться в бюджеты и дедлайны на разметку. - Оптимизация затрат <highlighttext>ML</highlighttext>-команды. - '}",Удаленная работа,,True,Другое,От 3 до 6 лет,Частичная занятость,"['Computer Vision', 'cv', 'ML']",,,,681
False,"MLOps инженер, Ozon Банк",Ozon Банк,False,False,Москва,,Ozon,"{'requirement': '...составляющих архитектуры <highlighttext>ML</highlighttext>-инфраструктуры; oпыт разворачивания MLFlow и NVIDIA Triton Inference Server. Будет плюсом: Опыт построения промышленной <highlighttext>ML</highlighttext>-инфраструктуры (получение...', 'responsibility': 'Развитие компонентов <highlighttext>ML</highlighttext>-платформы в парадигме Model as a Service. Развитие Observability сервисов <highlighttext>ML</highlighttext>-платформы. Реализация и сопровождение сервисов на...'}",Удаленная работа,,False,"BI-аналитик, аналитик данных",От 3 до 6 лет,Полная занятость,"['Python', 'Финансы', 'IT', 'Kafka', 'Kubernetes', 'MLOps', 'Apache Airflow', 'MLflow', 'Hadoop', 'Prometheus', 'Data engineer']",,,,503
False,Tech Lead команды ML-исследований,"""МТС"", Работа в IT",False,False,Москва,"{'city': 'Москва', 'street': 'Подсосенский переулок', 'building': '23с5', 'lat': 55.75553, 'lng': 37.654754, 'description': None, 'raw': 'Москва, Подсосенский переулок, 23с5', 'metro': {'station_name': 'Курская', 'line_name': 'Арбатско-Покровская', 'station_id': '3.70', 'line_id': '3', 'lat': 55.758564, 'lng': 37.659039}, 'metro_stations': [{'station_name': 'Курская', 'line_name': 'Арбатско-Покровская', 'station_id': '3.70', 'line_id': '3', 'lat': 55.758564, 'lng': 37.659039}, {'station_name': 'Курская', 'line_name': 'МЦД-2', 'station_id': '132.726', 'line_id': '132', 'lat': 55.757622, 'lng': 37.660767}, {'station_name': 'Чкаловская', 'line_name': 'Люблинско-Дмитровская', 'station_id': '10.72', 'line_id': '10', 'lat': 55.755951, 'lng': 37.659293}], 'id': '7057162'}",МТС,"{'requirement': 'Знания и практический опыт в области практического глубокого обучения, в идеале - в сфере обработки звука, но у нас много примеров...', 'responsibility': 'Руководство процессом обучения МЛ моделей и получение финальных решений в области распознавания/синтеза речи. Взаимодействие с руководством продукта и заказчиками...'}",Удаленная работа,,False,Руководитель группы разработки,От 3 до 6 лет,Полная занятость,[],,,,151
False,IT-рекрутер (machine learning),Яндекс,False,False,Москва,"{'city': 'Москва', 'street': 'улица Льва Толстого', 'building': '16', 'lat': 55.733771, 'lng': 37.587937, 'description': None, 'raw': 'Москва, улица Льва Толстого, 16', 'metro': {'station_name': 'Парк культуры', 'line_name': 'Сокольническая', 'station_id': '1.103', 'line_id': '1', 'lat': 55.736163, 'lng': 37.595027}, 'metro_stations': [{'station_name': 'Парк культуры', 'line_name': 'Сокольническая', 'station_id': '1.103', 'line_id': '1', 'lat': 55.736163, 'lng': 37.595027}], 'id': '158683'}",Яндекс,"{'requirement': 'Любите самостоятельно искать редких специалистов и выстраивать отношения с кандидатами. Умеете вести эффективную коммуникацию и проявляете гибкость, готовы работать с...', 'responsibility': 'Полный цикл найма. Предстоит отвечать за полный цикл поиска кандидатов: от сбора требований и разработки стратегии поиска до формирования и...'}",Полный день,,False,Менеджер по персоналу,От 1 года до 3 лет,Полная занятость,"['Подбор персонала', 'IT Recruitment', 'Оценка кандидатов', 'LinkedIn', 'Сорсинг']",,,,100
False,Разработчик баз данных (Oracle),,False,False,Москва,,Астор,"{'requirement': 'Хорошие знания PL/SQL, принципов и архитектуры СУБД Oracle. Уверенное знание SQL (аналитические функции, умение писать сложные запросы, оптимизация запросов). ', 'responsibility': 'Разработкой базы данных для SAAS приложения по автоматизации розничной торговли. Разработкой серверной части приложения на PL/SQL. Написанием и оптимизацией...'}",Удаленная работа,,False,Продуктовый аналитик,От 3 до 6 лет,Полная занятость,"['SQL', 'PostgreSQL', 'СУБД', 'ORACLE']",,,,176
False,ML-инженер (Computer Vision),,False,False,Москва,"{'city': None, 'street': None, 'building': None, 'lat': None, 'lng': None, 'description': None, 'raw': None, 'metro': {'station_name': 'Бабушкинская', 'line_name': 'Калужско-Рижская', 'station_id': '6.13', 'line_id': '6', 'lat': 55.870641, 'lng': 37.664341}, 'metro_stations': [{'station_name': 'Бабушкинская', 'line_name': 'Калужско-Рижская', 'station_id': '6.13', 'line_id': '6', 'lat': 55.870641, 'lng': 37.664341}], 'id': '4429205'}",Spice Agency,"{'requirement': 'Высшее техническое/математическое образование. Опыт работы в области <highlighttext>ML</highlighttext> и наличие практических достижений в этой области. Знание основных алгоритмов и...', 'responsibility': 'Участие в сборе и обработке/подготовке данных. Разработка моделей машинного обучения (классификация изображений, обнаружение/трекинг объектов). Разработка программных модулей предобработки...'}",Полный день,,False,"Программист, разработчик",От 3 до 6 лет,Полная занятость,"['ML', 'Машинное обучение', 'Математическое моделирование', 'Компьютерное зрение', 'Python', 'TensorFlow', 'Математическая статистика']",,,,630
False,Junior+ or Middle full-stack C#/JS Software Engineer,,False,False,Минск,,Центория Софт,"{'requirement': 'Proven interests in CS / <highlighttext>ML</highlighttext> / NLP / AI. Nice to have a blog or stack overflow activity or open-source activity. ', 'responsibility': 'We have a clear and transparent promotional policy designed to keep you motivated on the path to mastery. '}",Полный день,,False,"Программист, разработчик",От 1 года до 3 лет,Полная занятость,"['Python', 'SQL', 'C++', 'Английский язык', 'C#', 'JavaScript', 'react.js', 'vue.js', 'Design Patterns', 'ООП', 'Computer Science', 'ASP.NET', 'PostgreSQL', 'React', 'Backend', 'ASP.NET Core', 'ASP.NET MVC']",119731.0,47892.72030651341,191570.88122605364,431
False,ML-инженер,,False,False,Таганрог,"{'city': 'Таганрог', 'street': 'улица Чехова', 'building': '98А', 'lat': 47.210859, 'lng': 38.922869, 'description': None, 'raw': 'Таганрог, улица Чехова, 98А', 'metro': None, 'metro_stations': [], 'id': '15397803'}",Т-Банк,"{'requirement': 'Опыт разработки моделей машинного обучения с использованием современных DL фреймворков (Tensorflow, Pytorch, Keras, etc) и применения их в продакшене. ', 'responsibility': 'Речевые технологии. Автоматизируем голосовое общение между бизнесом и клиентами. <highlighttext>ML</highlighttext>-антифрод. С помощью алгоритмов оберегаем пользователей от мошенников, оперативно замечая...'}",Полный день,,False,"Программист, разработчик",От 3 до 6 лет,Полная занятость,[],,,,371
False,Team Lead Data Scientist (кредитный скоринг),,False,False,Москва,,Займиго МФК,"{'requirement': 'Лидерские способности, опыт управления командой. Отличные аналитические навыки. Высшее математическое, техническое, естественнонаучное образование. Отличные знания математической статистики и теории вероятностей. ', 'responsibility': 'Управление процессами и развитие команды (6 сотрудников). Консультирование заказчика при постановке/утверждении задач. Создание и оптимизация системы принятия решений. '}",Удаленная работа,,False,Аналитик,От 3 до 6 лет,Полная занятость,"['Python', 'SQL', 'Математическая статистика', 'Теория вероятности', 'Прикладная статистика', 'Машинное обучение', 'Скоринг', 'Прогнозирование', 'ML', 'Machine learning', 'Риск менеджмент', 'Риск аналитика', 'Fintech', 'Банки', 'A/B тесты', 'Excel']",,,,295
False,ML Researcher,,False,False,Москва,,Спектральные Технологии,"{'requirement': 'Разрабатывали и внедряли масштабируемые и воспроизводимые <highlighttext>ML</highlighttext>-пайплайны. Умеете генерировать идеи и знаете, как отличить хорошую идею от плохой. ', 'responsibility': 'Мы доверим: Ответственность за полный цикл разработки и запуска <highlighttext>ML</highlighttext>-моделей для оптимизации торговых стратегий. Дизайн и проведение экспериментов для...'}",Полный день,,False,Другое,От 3 до 6 лет,Полная занятость,[],,,,26
False,DevOps engineer (DS ML),Группа НЛМК ИТ и Диджитал,False,False,Москва,,Группа НЛМК,"{'requirement': 'Опыт и знания в администрировании Linux-систем: минимум 3 года практического опыта работы с Linux-системами. Экспертиза в эксплуатации и...', 'responsibility': 'Установка и конфигурирование кластера Ceph. Создание и администрирование Kubernetes кластеров, использование Ceph в качестве storage class. Участие в ПМИ кластеров...'}",Полный день,,False,DevOps-инженер,От 1 года до 3 лет,Полная занятость,"['DevOps', 'Kubernetes', 'Prometheus', 'Python', 'Helm', 'Linux', 'Ceph']",,,,610
False,ML-разработчик в службу ML Финтеха,Яндекс,False,False,Москва,,Яндекс,"{'requirement': 'Понимаете принципы классического машинного обучения. Хорошо знакомы с Python и SQL, желательно с C++.', 'responsibility': 'Служба <highlighttext>ML</highlighttext> Финтеха занимается всем машинным обучением в Банке - от скоринговых моделей до выделения маркетинговых сегментов. Улучшать модели скоринга для...'}",Полный день,,False,"Программист, разработчик",Более 6 лет,Полная занятость,[],,,,340
False,Инженер земной станции приёма данных (ЗС ПД),,False,False,Москва,"{'city': 'Москва', 'street': 'Докукина', 'building': '8', 'lat': 55.838299, 'lng': 37.654502, 'description': None, 'raw': 'Москва, Докукина, 8', 'metro': {'station_name': 'Ботанический сад', 'line_name': 'Калужско-Рижская', 'station_id': '6.24', 'line_id': '6', 'lat': 55.844597, 'lng': 37.637811}, 'metro_stations': [{'station_name': 'Ботанический сад', 'line_name': 'Калужско-Рижская', 'station_id': '6.24', 'line_id': '6', 'lat': 55.844597, 'lng': 37.637811}, {'station_name': 'Ростокино', 'line_name': 'МЦК', 'station_id': '95.518', 'line_id': '95', 'lat': 55.839444, 'lng': 37.667778}], 'id': '114709'}",БАРЛ НПК,"{'requirement': 'Высшее техническое образование. Стрессоустойчивость, обучаемость, готовность к краткосрочным командировкам. Опыт работы в ракетно-космической промышленности в области разработки и/или...', 'responsibility': 'Контроль состояния технических средств ЗС ПД. Формирование плана проведение сеансов приёма данных ЗС с КА. Проведение сеансов приёма данных с...'}",Полный день,,False,"Сервисный инженер, инженер-механик",От 1 года до 3 лет,Полная занятость,"['наземные средства управления КС', 'земная станция приёма данных']",,,,201
