premium,name,department,has_test,response_letter_required,area,address,employer,snippet,schedule,working_time_intervals,accept_temporary,professional_roles,experience,employment,key_skills,average_salary,min_salary,max_salary,hours_since_publication
False,Data Analyst / Data Scientist,,False,False,Москва,"{'city': 'Москва', 'street': 'Пресненская набережная', 'building': '12', 'lat': 55.749633, 'lng': 37.537434, 'description': None, 'raw': 'Москва, Пресненская набережная, 12', 'metro': None, 'metro_stations': [], 'id': '14049955'}",Итсен,"{'requirement': 'Понимание принципов машинного обучения и опыта в применении <highlighttext>ML</highlighttext> моделей. Опыт работы с большими данными и знание инструментов для их...', 'responsibility': 'Вам предстоит анализировать большие объемы данных, разрабатывать модели для прогнозирования и оптимизации бизнес-процессов, а также предоставлять инсайты для улучшения...'}",Полный день,,False,Дата-сайентист,От 3 до 6 лет,Полная занятость,"['Python', 'SQL', 'Обучение и развитие', 'Data Mining', 'Английский язык', 'Бизнес-анализ', 'Аналитика', 'MS SQL', 'Data Analysis', 'Linux', 'Data Scientist', 'QlikView', 'Статистический анализ', 'Big Data', 'DataLens', 'Hadoop', 'Spark', 'PostgreSQL']",437500.0,350000.0,,175
False,Аналитик ML,МТС Банк. Головной офис,False,False,Москва,,МТС Финтех,"{'requirement': 'Опыт построения отчетности. Опыт разработки предиктивных моделей с помощью Python, библиотек sklearn, LightGBM, XGBoost. Знание предметной области экономико-статистического моделирования. ', 'responsibility': 'Анализировать мошеннические схемы, разрабатывать алгоритмы их детектирования. Участие в автоматизации текущей антифрод логики. Прогнозировать возникновение новых схем, предлагать гипотезы и...'}",Полный день,,False,"BI-аналитик, аналитик данных",От 1 года до 3 лет,Полная занятость,"['SQL', 'Python', 'XGBoost']",,,,360
False,Middle Data Scientist,Сбер для экспертов,False,False,Москва,,СБЕР,"{'requirement': 'Опыт использования библиотек анализа данных и построения <highlighttext>ML</highlighttext> моделей на Python (xgboost/lightgbm/catboost, numpy/pandas/dask, sklearn, …), понимание особенностей...', 'responsibility': 'Вам предстоит создавать модели машинного обучения для системы форд-мониторинга Сбербанка, которая обеспечивает защиту клиентов банка во всех каналах обслуживания...'}",Полный день,,False,Другое,От 1 года до 3 лет,Полная занятость,[],,,,599
False,DevOps Engineer,,False,False,Москва,,Digital Zone,"{'requirement': 'Опыт развёртывания и управления кластерами Spark. Уверенные знания одного из менеджеров кластеров Spark, таких как YARN или Mesos. ', 'responsibility': 'Оптимизация производительности и использования ресурсов кластера. * Взаимодействие с командой разработчиков машинного обучения (<highlighttext>ML</highlighttext>). * Внедрение решений для мониторинга и ведения логов...'}",Удаленная работа,,False,DevOps-инженер,От 3 до 6 лет,Полная занятость,[],375000.0,300000.0,,652
False,Machine learning engineer (middle/senior) в команду ML Search,,False,False,Москва,,AliExpress,"{'requirement': 'Уверенное владение Python и способность написать код для продакшена. Знание классических <highlighttext>ML</highlighttext> алгоритмов и статистических подходов. Опыт в распределенных/параллельных...', 'responsibility': 'Улучшить одну из частей поиска 150 млн товаров для 60 млн пользователей (саджесты, предсказание интента пользователя, реколл, ранжирование, исправление опечаток...'}",Полный день,,False,Дата-сайентист,От 1 года до 3 лет,Полная занятость,"['Python', 'ML', 'ETL', 'Apache Airflow', 'Spark', 'Apache Hive', 'CI/CD', 'Hadoop', 'MLflow', 'PyTorch', 'CatBoost']",,,,697
False,"Middle / Senior ML Engineer (Python), удаленно",,False,False,Москва,,RedLab,"{'requirement': 'Хорошие знания алгоритмов и структур данных. Высшее образование в области математики или информатики. Опыт коммерческой разработки на Python от 3...', 'responsibility': 'Этапы отбора: Первичное интервью и технический скрининг. Техническое интервью. Оффер.'}",Удаленная работа,,True,"Программист, разработчик",От 3 до 6 лет,Полная занятость,"['Python', 'TensorFlow', 'Keras', 'Caffe', 'PyTorch', 'GPT', 'NLP', 'Numpy', 'SciPy', 'Scikit-learn', 'pandas']",,,,463
False,Data Scientist,,False,False,Москва,"{'city': 'Москва', 'street': 'улица Чаплыгина', 'building': '20с7', 'lat': 55.761619, 'lng': 37.64949, 'description': None, 'raw': 'Москва, улица Чаплыгина, 20с7', 'metro': {'station_name': 'Курская', 'line_name': 'Арбатско-Покровская', 'station_id': '3.70', 'line_id': '3', 'lat': 55.758564, 'lng': 37.659039}, 'metro_stations': [{'station_name': 'Курская', 'line_name': 'Арбатско-Покровская', 'station_id': '3.70', 'line_id': '3', 'lat': 55.758564, 'lng': 37.659039}], 'id': '15363261'}",AdRiver,"{'requirement': 'Высшее техническое образование. Знание математики и статистики. Опыт работы с <highlighttext>ML</highlighttext>, нейросетями, GBDT. Опыт тестирования моделей. Знания SQL. ', 'responsibility': 'Исследование поведения системы и статистических аномалий. Генерация гипотез и их проверка. Дизайн и проведение a/b тестов. Поиск точек роста...'}",Полный день,,False,Дата-сайентист,От 3 до 6 лет,Полная занятость,[],,,,315
False,Стажер RecSyS в Sber AI Lab,Сбер для экспертов,False,False,Москва,,СБЕР,"{'requirement': '...стандартными библиотеками(pandas, numpy, sklearn, pytorch, pyspark). Интересуешься recsys и знаешь алгоритмы из этой области. Разбираешься в <highlighttext>ML</highlighttext> и DL.', 'responsibility': 'Участвовал в DS соревнованиях Kaggle и пр. Любишь изучать новые алгоритмы и читать статьи.'}",Полный день,,False,Аналитик,Нет опыта,Стажировка,[],,,,481
False,Middle Backend Python разработчик,,False,False,Санкт-Петербург,"{'city': 'Санкт-Петербург', 'street': 'Биржевая линия', 'building': '14', 'lat': 59.944337, 'lng': 30.295207, 'description': None, 'raw': 'Санкт-Петербург, Биржевая линия, 14', 'metro': {'station_name': 'Василеостровская', 'line_name': 'Невско-Василеостровская', 'station_id': '16.228', 'line_id': '16', 'lat': 59.942577, 'lng': 30.278254}, 'metro_stations': [{'station_name': 'Василеостровская', 'line_name': 'Невско-Василеостровская', 'station_id': '16.228', 'line_id': '16', 'lat': 59.942577, 'lng': 30.278254}], 'id': '487196'}",Университет ИТМО,"{'requirement': 'Умение писать чистый и поддерживаемый код. Покрытие кода тестами. Понимание принципов построения микросервисной архитектуры и опыт разработки микросервисов. ', 'responsibility': 'Разработка и проектирование ПО. Разработка ПО от R&D до корпоративного решения (Enterprise) - «трансфер технологий». Code Review.'}",Полный день,,False,"Программист, разработчик",От 1 года до 3 лет,Полная занятость,"['Python', 'FastAPI', 'SQLAlchemy', 'Опыт разработки микросервисов']",225000.0,180000.0,,268
False,Data Scientist,,False,False,Москва,,Точка,"{'requirement': 'Есть опыт работы с классическим <highlighttext>ML</highlighttext>-стеком от 3 лет. Умеешь проводить A/B-тесты и владеешь статистикой. ', 'responsibility': 'Прогнозировать отток клиентов из банка. Сегментировать клиентов по их виду деятельности и по роли в компании. Персонализировать депозитные условия для...'}",Удаленная работа,,False,Дата-сайентист,От 3 до 6 лет,Полная занятость,[],373500.0,,450000.0,174
False,Data Scientist (Розница),,False,False,Москва,"{'city': 'Ташкент', 'street': 'улица Нукус', 'building': '29А', 'lat': 41.294297, 'lng': 69.282836, 'description': None, 'raw': 'Ташкент, улица Нукус, 29А', 'metro': None, 'metro_stations': [], 'id': '12479036'}",AVO.UZ,"{'requirement': 'Высшее образование в области математики, статистики, информатики, прикладной математики или смежных дисциплин. Опыт работы Data Scientist от 2 лет. ', 'responsibility': 'Разработка и внедрение <highlighttext>ML</highlighttext> моделей для управления клиентским поведением и коммуникациями (кластеризация и сегментация, жизненный цикл, оттоки и пр.). '}",Удаленная работа,,False,Дата-сайентист,От 3 до 6 лет,Полная занятость,[],,,,31
False,Аналитик данных,,False,False,Москва,"{'city': 'Москва', 'street': 'Крылатская улица', 'building': '17к1', 'lat': 55.770552, 'lng': 37.424138, 'description': None, 'raw': 'Москва, Крылатская улица, 17к1', 'metro': {'station_name': 'Крылатское', 'line_name': 'Арбатско-Покровская', 'station_id': '3.65', 'line_id': '3', 'lat': 55.756842, 'lng': 37.408139}, 'metro_stations': [{'station_name': 'Крылатское', 'line_name': 'Арбатско-Покровская', 'station_id': '3.65', 'line_id': '3', 'lat': 55.756842, 'lng': 37.408139}, {'station_name': 'Мнёвники', 'line_name': 'Большая кольцевая линия', 'station_id': '97.805', 'line_id': '97', 'lat': 55.761153, 'lng': 37.47139}, {'station_name': 'Полежаевская', 'line_name': 'Таганско-Краснопресненская', 'station_id': '7.114', 'line_id': '7', 'lat': 55.777201, 'lng': 37.517895}], 'id': '15356563'}","Ренессанс cтрахование, Группа","{'requirement': 'Владеет одним из диалектов SQL (T-SQL, PL/SQL), умеет писать сложные запросы. Понимает принципы функционирования хранилищ данных / систем аналитической...', 'responsibility': 'Знает Python для анализа данных и построения <highlighttext>ML</highlighttext>-моделей (pandas, numpy, sciPy, sklearn, matplotlib/seaborn/plotly и др). '}",Полный день,,False,"BI-аналитик, аналитик данных",От 1 года до 3 лет,Полная занятость,"['SQL', 'Python', 'Аналитика', 'Математическая статистика', 'Анализ данных']",,,,529
False,Data engineer (ML),,False,False,Москва,"{'city': None, 'street': None, 'building': None, 'lat': None, 'lng': None, 'description': None, 'raw': None, 'metro': {'station_name': 'Ленинский проспект', 'line_name': 'Калужско-Рижская', 'station_id': '6.74', 'line_id': '6', 'lat': 55.70678, 'lng': 37.58499}, 'metro_stations': [{'station_name': 'Ленинский проспект', 'line_name': 'Калужско-Рижская', 'station_id': '6.74', 'line_id': '6', 'lat': 55.70678, 'lng': 37.58499}], 'id': '6084181'}",Bell Integrator,"{'requirement': 'Понимание или опыт разработки на python (ETL-процессы Airflow). Знание специфики python для <highlighttext>ml</highlighttext>: библиотеки (catboost, lightgbm e t.c.). ', 'responsibility': 'Системная разработка, поддержка и оптимизация ETL-процессов и <highlighttext>ML</highlighttext>-моделей (MLOps) на платформах Greenplum и Hadoop. R&D. '}",Полный день,,False,Дата-сайентист,От 1 года до 3 лет,Полная занятость,[],,,,697
False,Middle Data scientist (GIS),,False,False,Москва,,"МАГНИТ, Розничная сеть","{'requirement': 'Опыт в сфере от 1 года. Опыт запуска моделей в продакшн. Опыт решения практических задач прогнозирования. Ориентированность на нужный результат...', 'responsibility': 'Работать в команде с высокой экспертизой в прогнозировании AI-алгоритмами (статистические модели, <highlighttext>ML</highlighttext> алгоритмы, Deep Learning). Развивать прод-системы прогнозирования...'}",Полный день,,False,Другое,От 1 года до 3 лет,Полная занятость,"['SQL', 'Python', 'ML']",,,,605
False,Data Engineer,,False,False,Москва,"{'city': None, 'street': None, 'building': None, 'lat': None, 'lng': None, 'description': None, 'raw': None, 'metro': {'station_name': 'Павелецкая', 'line_name': 'Замоскворецкая', 'station_id': '2.101', 'line_id': '2', 'lat': 55.729741, 'lng': 37.638693}, 'metro_stations': [{'station_name': 'Павелецкая', 'line_name': 'Замоскворецкая', 'station_id': '2.101', 'line_id': '2', 'lat': 55.729741, 'lng': 37.638693}], 'id': '6232936'}",Genius Group,"{'requirement': 'Опыт работы с python и работы с базами данных. Базовые знания математической статистики. Умение построения регрессионных моделей и оценка их...', 'responsibility': 'Создавать <highlighttext>ML</highlighttext>-предикторы для оптимизации рекламных кампаний. Отслеживать реальную просматриваемость рекламного объявления (Viewability targeting on <highlighttext>ML</highlighttext>). Оптимизировать <highlighttext>ML</highlighttext> модели. '}",Полный день,,False,Дата-сайентист,От 1 года до 3 лет,Полная занятость,"['Python', 'SQL', 'Математическая статистика']",250000.0,200000.0,,54
False,Руководитель направления по аналитике данных,Сбер для экспертов,False,False,Москва,,СБЕР,"{'requirement': 'Ехсеl - продвинутые пользователь. - Хорошее знание SQL, опыт написания сложных запросов. - Приветствуется опыт построения дашбордов(Qlik, Tableau, Grafana и т.д.). - ', 'responsibility': 'Визуализация данных и подготовка презентаций для обоснования изменений, защита результатов исследования. - Встраивание результатов <highlighttext>ML</highlighttext> моделей в бизнес процесс, пересмотр процесса...'}",Полный день,,False,Аналитик,От 3 до 6 лет,Полная занятость,[],,,,315
False,Дата-аналитик (Python) в команде развития CVM,"ПАО ВТБ, Средний и малый бизнес",False,False,Москва,,Банк ВТБ (ПАО),"{'requirement': 'Навыки обработки данных с помощью Python (pandas, seaborn, sklearn и тд) и Excel. Преимуществом будет являться знание классического <highlighttext>ML</highlighttext> и...', 'responsibility': 'Приемка моделей от команды моделирования и мониторинг качества моделей. Автоматизация формирования маркетинговых предложений в различных каналах, оптимизация маркетинговых предложений. '}",Полный день,,False,"BI-аналитик, аналитик данных",От 1 года до 3 лет,Полная занятость,"['SQL', 'Python', 'Аналитика', 'Работа с базами данных', 'Аналитические исследования']",,,,290
False,BI Analyst - BI Engineer,,False,False,Астана,,G5EN KAZ,"{'requirement': 'Business analysis and understanding of business processes. Ability to design and maintain datasets and data models in a DWH (DataVault...', 'responsibility': 'Writing and maintaining documentation and specifications for reporting, data models (non-<highlighttext>ML</highlighttext> models), and data flows. Participation in Data Governance...'}",Полный день,,False,"BI-аналитик, аналитик данных",От 3 до 6 лет,Полная занятость,"['Redshift', 'MS SQL', 'Superset', 'DWH', 'Tableau']",,,,101
False,ML разработчик (ИБ),,False,False,Москва,,Вебмониторэкс,"{'requirement': 'Высшее техническое образование. Отличное знание Python и его библиотек для машинного обучения (TensorFlow, PyTorch). Опыт работы с большими объемами данных...', 'responsibility': 'Разработка и реализация моделей машинного обучения. Анализ данных и выбор оптимальных параметров модели. Тестирование и оптимизация моделей. Взаимодействие с командой...'}",Полный день,,False,"Программист, разработчик",От 1 года до 3 лет,Полная занятость,[],,,,630
False,Разработчик AL/LLM,,False,False,Москва,"{'city': 'Москва', 'street': 'Холодильный переулок', 'building': '3', 'lat': 55.708394, 'lng': 37.625397, 'description': None, 'raw': 'Москва, Холодильный переулок, 3', 'metro': None, 'metro_stations': [], 'id': '12982553'}",Частное учреждение по цифровизации атомной отрасли «Цифрум»,"{'requirement': 'Практический опыт работы с технологиями LLM, RAG, LangChain от 1 года. Практический опыт в решении прикладных задач с помощью машинного...', 'responsibility': 'Проектирование и реализация сервисов, связанных с применением LLM. Формирование видения развития направления, апробация существующих на рынке моделей и подходов к...'}",Полный день,,False,"Программист, разработчик",От 3 до 6 лет,Полная занятость,"['LLM', 'ML', 'SQL', 'Natural Language Processing', 'Python']",,,,200
False,SQL разработчик / Data Engineer,ЦУМ (Digital &  IT),False,False,Москва,,"ЦУМ, ТД","{'requirement': 'Опыт в очистке и подготовке данных для целей <highlighttext>ML</highlighttext> и статистического анализа. Знания и опыт использования keras для задач регрессии...', 'responsibility': 'Поддержка механизма экстракции данных: настройка источников, таблиц и полей для экстракции, управления расписаниями экстракции. Разработка нового функционала на основании задач...'}",Полный день,,False,"Программист, разработчик",От 3 до 6 лет,Полная занятость,[],,,,647
False,Lead Data Scientist,,False,False,Москва,"{'city': 'Москва', 'street': 'Сокольническая линия', 'building': 'метро Университет', 'lat': 55.692612, 'lng': 37.533526, 'description': None, 'raw': 'Москва, Сокольническая линия, метро Университет', 'metro': None, 'metro_stations': [], 'id': '6830199'}",Clear Mind,"{'requirement': 'Опыт применения основных алгоритмов машинного обучения. Опыт работы с библиотеками python (sklearn, xgboost, TensorFlow, PyTorch, Catboost). Знаешь линейную алгебру (сюда...', 'responsibility': 'Строить, оценивать и внедрять <highlighttext>ML</highlighttext>-модели. Строить и статистически проверять гипотезы по имеющимся данным, предлагать включение новых данных. Строить <highlighttext>ML</highlighttext>...'}",Полный день,,False,Дата-сайентист,От 3 до 6 лет,Полная занятость,[],,,,461
False,Senior Backend Engineer,,False,False,Москва,,STARTRIBE LTD,"{'requirement': 'Опыт работы в R&D-командах, взаимодействие и интеграция <highlighttext>ML</highlighttext> технологий.  Знания в области поисковых систем и алгоритмов.  ', 'responsibility': 'Написание, интеграция и оптимизация server-side ПО.  Тестирование и мониторинг ПО.  Создание архитектуры ПО, участие в планировании разработки.  '}",Полный день,,False,"Программист, разработчик",От 3 до 6 лет,Полная занятость,"['Python', 'FastAPI', 'Linux', 'Docker']",,,,25
False,Python разработчик (Маркетинг AI),Сбер для экспертов,False,False,Москва,,СБЕР,"{'requirement': 'Опыт работы с БД, реализация сложных запросов. Опыт создания <highlighttext>ML</highlighttext>-пайплайнов/backend сервисов. Базовые знания docker. Bash, git. ', 'responsibility': 'Разработка интеграционных взаимодействий между сервисами и с другими системами. Участие в проектировании архитектуры <highlighttext>ML</highlighttext>-сервисов. Оптимизация кода моделей для достижения...'}",Полный день,,False,"Программист, разработчик",От 3 до 6 лет,Полная занятость,[],,,,487
