premium,name,department,has_test,response_letter_required,area,address,employer,snippet,schedule,working_time_intervals,accept_temporary,professional_roles,experience,employment,key_skills,average_salary,min_salary,max_salary,hours_since_publication
False,MLE (Comprehend 360),Сбер для экспертов,False,False,Москва,,СБЕР,"{'requirement': 'Высшее техническое образование. Опыт работы data science или backend разработчиком от 1,5 лет. Опыт работы с NLP моделями (классификация...', 'responsibility': 'Разработка новых функциональных модулей обработки данных и запуска моделей <highlighttext>ML</highlighttext>. R&D по развитию web-продукта. Покрытие тестами разработанного ПО...'}",Полный день,,False,Аналитик,От 1 года до 3 лет,Полная занятость,[],,,,29
False,Senior Data Scientist (Recommender Systems),,False,False,Кипр,"{'city': 'город Лимасол', 'street': 'Limassol, Digeni Akrita', 'building': None, 'lat': 34.680759, 'lng': 33.051768, 'description': None, 'raw': 'город Лимасол, Limassol, Digeni Akrita', 'metro': None, 'metro_stations': [], 'id': '6786880'}",FunCorp,"{'requirement': 'Опыт построения ленты рекомендаций. Опыт полного цикла решения <highlighttext>ML</highlighttext>-задачи: предобработка данных, выбор алгоритмов и тюнинг их параметров, оценка качества...', 'responsibility': 'Сбор, обработка и исследование данных. Поиск гипотез, создание бэклога и приоритезация задач. Создание рекомендательных моделей, повышающих продуктовые метрики. '}",Полный день,,False,Дата-сайентист,От 3 до 6 лет,Полная занятость,"['DS', 'Data Science', 'Data Scientist', 'Recommender Systems', 'Рекомендательные системы', 'Senior']",601464.0,523012.5523012552,679916.3179916317,7
False,Data Scientist в команду персонализации,Газпромбанк,False,False,Екатеринбург,,Газпромбанк,"{'requirement': 'Занимались построением рекомендательных систем. Имеете практический опыт полного цикла решения <highlighttext>ML</highlighttext> задачи: предобработка данных, выбор алгоритмов и тюнинг их параметров...', 'responsibility': 'Разрабатывать и внедрять <highlighttext>ML</highlighttext> модели привлечения, предложений, оттока. Анализировать поведение клиентов и оптимизировать алгоритмы рекомендаций. Оценивать эффективность рекомендательной системы. '}",Полный день,,False,Дата-сайентист,От 1 года до 3 лет,Полная занятость,[],,,,367
False,ML-инженер,,False,False,Ижевск,,Т-Банк,"{'requirement': 'Опыт разработки моделей машинного обучения с использованием современных DL фреймворков (Tensorflow, Pytorch, Keras, etc) и применения их в продакшене. ', 'responsibility': 'Речевые технологии. Автоматизируем голосовое общение между бизнесом и клиентами. <highlighttext>ML</highlighttext>-антифрод. С помощью алгоритмов оберегаем пользователей от мошенников, оперативно замечая...'}",Полный день,,False,"Программист, разработчик",От 3 до 6 лет,Полная занятость,[],,,,489
False,Руководитель направления CRM\CVM x-sell продажи,Газпромбанк,False,False,Москва,,Газпромбанк,"{'requirement': 'Опыт управления команд в CVM направлении. Понимает как работают инструменты <highlighttext>ML</highlighttext> в розничном бизнесе банков. Имеет опыт подготовки емких и...', 'responsibility': 'Лидировании функции CRM-продаж. Создание и реализация стратегии развития вторичных продаж продуктов Банка, включая активные коммуникации и взаимодействие с клиентом...'}",Полный день,,False,Другое,От 3 до 6 лет,Полная занятость,[],,,,8
False,Data Scientist в команду персонализации,Газпромбанк,False,False,Москва,,Газпромбанк,"{'requirement': 'Занимались построением рекомендательных систем. Имеете практический опыт полного цикла решения <highlighttext>ML</highlighttext> задачи: предобработка данных, выбор алгоритмов и тюнинг их параметров...', 'responsibility': 'Разрабатывать и внедрять <highlighttext>ML</highlighttext> модели привлечения, предложений, оттока. Анализировать поведение клиентов и оптимизировать алгоритмы рекомендаций. Оценивать эффективность рекомендательной системы. '}",Полный день,,False,Дата-сайентист,От 1 года до 3 лет,Полная занятость,[],,,,367
False,Senior Data Engineer,,False,False,Москва,,Instories,"{'requirement': 'Опыт коммерческой разработки от 5-ти лет.  Отличное знание Python и SQL.  Опыт работы с реляционными БД.  Опыт работы с...', 'responsibility': 'Писать новый и поддерживать существующий код.  Создавать сложные и переиспользуемые архитектурные решения.  Активно развивать аналитическую платформу Instories в части сбора...'}",Удаленная работа,,False,"Программист, разработчик",Более 6 лет,Полная занятость,"['Python', 'Clickhouse', 'PostgreSQL']",,,,151
False,AI/ML Solutions Architect,"МТБанк, BACK-OFFICE",False,False,Минск,"{'city': 'Минск', 'street': 'улица Змитрока Бядули', 'building': '11', 'lat': 53.9040103961982, 'lng': 27.58559954844438, 'description': None, 'raw': 'Минск, улица Змитрока Бядули, 11', 'metro': {'station_name': 'Площадь Победы', 'line_name': 'Московская', 'station_id': '62.409', 'line_id': '62', 'lat': 53.908644, 'lng': 27.575054}, 'metro_stations': [{'station_name': 'Площадь Победы', 'line_name': 'Московская', 'station_id': '62.409', 'line_id': '62', 'lat': 53.908644, 'lng': 27.575054}], 'id': '7063296'}",МТБанк,"{'requirement': 'Опыт проектирования и внедрения комплексных решений AI/<highlighttext>ML</highlighttext> в on-premise инфраструктуре. Глубокие знания архитектурных принципов построения высокодоступных и отказоустойчивых...', 'responsibility': '...внедряемым решениям AI/<highlighttext>ML</highlighttext>. Предоставление экспертизы по разработке и внедрению решений AI/<highlighttext>ML</highlighttext>. Проектирование комплексной архитектуры AI/<highlighttext>ML</highlighttext>, включая прием...'}",Полный день,,False,Другое,От 1 года до 3 лет,Полная занятость,[],,,,393
False,"Data Analyst ""Growth""",,False,False,Москва,"{'city': 'Москва', 'street': 'Рочдельская улица', 'building': '15с13', 'lat': 55.755991, 'lng': 37.56512, 'description': None, 'raw': 'Москва, Рочдельская улица, 15с13', 'metro': {'station_name': 'Баррикадная', 'line_name': 'Таганско-Краснопресненская', 'station_id': '7.16', 'line_id': '7', 'lat': 55.760793, 'lng': 37.581242}, 'metro_stations': [{'station_name': 'Баррикадная', 'line_name': 'Таганско-Краснопресненская', 'station_id': '7.16', 'line_id': '7', 'lat': 55.760793, 'lng': 37.581242}, {'station_name': 'Краснопресненская', 'line_name': 'Кольцевая', 'station_id': '5.58', 'line_id': '5', 'lat': 55.760378, 'lng': 37.577114}, {'station_name': 'Улица 1905 года', 'line_name': 'Таганско-Краснопресненская', 'station_id': '7.146', 'line_id': '7', 'lat': 55.763944, 'lng': 37.562271}], 'id': '4008828'}",Okko,"{'requirement': 'опыт в маркетинговой аналитике/<highlighttext>ml</highlighttext>. Знание математической статистики и теории вероятностей на уверенном уровне. Знание основ машинного обучения.', 'responsibility': 'Проводить множество экспериментов промо. Проводить исследования точек роста в привлечении/удержании пользователей. Построение отчетности/новых метрик для маркетинга.'}",Полный день,,False,"BI-аналитик, аналитик данных",От 3 до 6 лет,Полная занятость,"['Python', 'SQL', 'A/B тесты']",,,,337
False,Senior Python-разработчик (команда разработки поиска),,False,False,Москва,"{'city': 'Москва', 'street': '2-й Крутицкий переулок', 'building': '18с1', 'lat': 55.729954, 'lng': 37.663818, 'description': None, 'raw': 'Москва, 2-й Крутицкий переулок, 18с1', 'metro': None, 'metro_stations': [], 'id': '4131523'}",Исходный код,"{'requirement': 'Опыт работы с фреймворками: FastAPI, Sanic. Опыт в <highlighttext>ML</highlighttext>. Понимание принципов SOLID, ООП, основных шаблонов проектирования. Опыт разработки под Linux. ', 'responsibility': 'Выполнение технически сложных задач, проектирование архитектуры приложений. Применение знаний в области доставки приложений на контур (CI/CD). Не только самостоятельное...'}",Полный день,,False,"Программист, разработчик",От 3 до 6 лет,Полная занятость,[],,,,27
False,Data Scientist в команду персонализации,Газпромбанк,False,False,Санкт-Петербург,,Газпромбанк,"{'requirement': 'Занимались построением рекомендательных систем. Имеете практический опыт полного цикла решения <highlighttext>ML</highlighttext> задачи: предобработка данных, выбор алгоритмов и тюнинг их параметров...', 'responsibility': 'Разрабатывать и внедрять <highlighttext>ML</highlighttext> модели привлечения, предложений, оттока. Анализировать поведение клиентов и оптимизировать алгоритмы рекомендаций. Оценивать эффективность рекомендательной системы. '}",Полный день,,False,Дата-сайентист,От 1 года до 3 лет,Полная занятость,[],,,,367
False,Data scientist,,False,False,Москва,"{'city': 'Москва', 'street': '2-й Южнопортовый проезд', 'building': '20Ас4', 'lat': 55.702389, 'lng': 37.693597, 'description': None, 'raw': 'Москва, 2-й Южнопортовый проезд, 20Ас4', 'metro': {'station_name': 'Кожуховская', 'line_name': 'Люблинско-Дмитровская', 'station_id': '10.52', 'line_id': '10', 'lat': 55.706156, 'lng': 37.68544}, 'metro_stations': [{'station_name': 'Кожуховская', 'line_name': 'Люблинско-Дмитровская', 'station_id': '10.52', 'line_id': '10', 'lat': 55.706156, 'lng': 37.68544}], 'id': '15848708'}",ВТБ Лизинг,"{'requirement': 'Высшее образование. Продвинутый уровень Python и SQL. Полный цикл построение <highlighttext>ML</highlighttext> моделей. Умение анализировать и структурировать данные, делать выводы, проверять...', 'responsibility': 'Выполнение задач внутри цикла разработке скоринговых <highlighttext>ML</highlighttext> моделей (PD, LGD, EAD) . Выдвижение гипотез/ идей, их проверка. Разработка <highlighttext>ML</highlighttext> моделей. '}",Полный день,,False,Дата-сайентист,От 3 до 6 лет,Полная занятость,"['Python', 'pandas', 'Numpy', 'XGBoost', 'CatBoost', 'Математическое моделирование']",,,,32
False,Senior Data Scientist/Machine Learning Engineer (Ranking),,False,False,Москва,,Ecom.tech,"{'requirement': 'Наличие опыта с продуктами стека Big Data (Hadoop, Spark). Опыт создания инфраструктуры для <highlighttext>ML</highlighttext> (model serving, MLOps). Умение коммуницировать как...', 'responsibility': 'Поиск. Учитывать релевантность запросов и пользовательских предпочтений. Классический <highlighttext>ML</highlighttext>. Предсказывать вероятность клика на рекламное предложение. Антифрод. Находить продавцов, которых не...'}",Удаленная работа,,False,Дата-сайентист,От 3 до 6 лет,Полная занятость,[],,,,172
False,"Data Scientist (NLP, LLM)",ГК Иннотех | Мультипродакт,False,False,Москва,,Т1,"{'requirement': 'Знания Linux, bash, Docker. Знание classic <highlighttext>ML</highlighttext>/NLP - инструментов (numpy, pandas, sklearn, nltk, spacy, pymorphy, natasha, regex и др.). ', 'responsibility': 'Наша команда занимается разработкой и внедрением моделей машинного обучения для NLP/PLP/LLM и смежными задачами. ИИ для разработчиков, генерация...'}",Удаленная работа,,False,Аналитик,От 3 до 6 лет,Полная занятость,"['NLP', 'ML', 'Linux', 'Python', 'Docker']",,,,605
False,Senior Data Scientist (Промо Прогноз),,False,False,Краснодар,,"МАГНИТ, Розничная сеть","{'requirement': 'Опыт лидирования команды из 3-4 человек, наставничество. Опыт работы с распределенными системами (HADOOP, Azure, YC DataProc) посредством Spark. ', 'responsibility': 'Работать в команде с высокой экспертизой в прогнозировании AI-алгоритмами (статистические модели, <highlighttext>ML</highlighttext> алгоритмы, Deep Learning). Лидировать команды из 4...'}",Удаленная работа,,False,Аналитик,От 3 до 6 лет,Полная занятость,"['SQL', 'Hadoop', 'Spark', 'Python', 'Airflow', 'Linux']",,,,605
False,MLOps в Яндекс Еду,Яндекс,False,False,Москва,,Яндекс,"{'requirement': '1. Построить модель здоровья <highlighttext>ML</highlighttext>-сервисов. На базовом уровне понимаете <highlighttext>ML</highlighttext> и концепции MLOps.', 'responsibility': 'Оптимизировать и улучшать аналитическую и <highlighttext>ML</highlighttext>-инфраструктуру, общаясь с её внутренними пользователями. Выстраивать конвейеры автоматизации <highlighttext>ML</highlighttext>-процессов и обработки данных. '}",Полный день,,False,"Программист, разработчик",От 3 до 6 лет,Полная занятость,[],,,,4
False,Senior Golang Developer (MLS Core),Разработка,False,False,Москва,"{'city': 'Москва', 'street': '2-я Звенигородская улица', 'building': '28', 'lat': 55.762885, 'lng': 37.557026, 'description': None, 'raw': 'Москва, 2-я Звенигородская улица, 28', 'metro': None, 'metro_stations': [], 'id': '12862635'}",Cloud.ru,"{'requirement': 'Опыт разработки на Golang инфраструктурных сервисов и операторов K8S. Опыт работы с gRPC; Опыт разработки на Python. ', 'responsibility': 'Разработка и поддержка продуктов облачного провайдера. Прототипирование и проектирование новых сервисов. Оптимизация производительности сервисов. Решение задач обеспечения отказоустойчивости и устойчивого...'}",Полный день,,False,"Программист, разработчик",От 3 до 6 лет,Полная занятость,[],,,,490
False,Lead Data Scientist в SberAI,Сбер для экспертов,False,False,Сочи,,СБЕР,"{'requirement': 'Аналогичный опыт работы от 4х лет. Образование: высшее техническое. Работа с данными (ex. как проверить корректность выбора тестового набора). ', 'responsibility': 'Управление командой в R&D на ФТ Сириус. Разработка <highlighttext>ML</highlighttext>-моделей в различных направлениях - как для Сбера и его клиентов...'}",Полный день,,False,Аналитик,От 3 до 6 лет,Полная занятость,[],,,,271
False,Data Engineer,Газпромбанк,False,False,Екатеринбург,,Газпромбанк,"{'requirement': 'Уверенно пишете код на Python. - Имеете опыт применения Spark/PySpark. - Работали с Unix OS, bash, Git. - Имеете опыт работы с...', 'responsibility': 'Вам предстоит организовывать хранение и обработку большого объема данных, обеспечивать процессы для подготовки витрин данных. ЧЕМ БУДЕШЬ ЗАНИМАТЬСЯ? - '}",Удаленная работа,,False,Дата-сайентист,От 3 до 6 лет,Полная занятость,[],,,,531
False,Системный аналитик / Дата-аналитик (RTB),,False,False,Москва,,ProfIT Family,"{'requirement': 'Опыт работы с рекламным продуктом. Опыт работы с RTB/DSP/SSP. Опыт в проектирование API, архитектуры, уметь мыслить в категориях...', 'responsibility': 'DMP - позволяет собирать атрибуты из сырых данных как в реалтайме так и в фоне (не <highlighttext>ML</highlighttext>). Искать факторы, влияющие на...'}",Удаленная работа,,False,Системный аналитик,От 3 до 6 лет,Полная занятость,"['Анализ данных', 'RTB', 'SQL', 'Системный анализ', 'Базы данных', 'Работа с базами данных', 'DSP']",,,,27
False,Руководитель направления сопровождения ALM моделей / MLOps,Альфа-Банк,False,False,Москва,"{'city': 'Москва', 'street': 'Маши Порываевой', 'building': '7', 'lat': 55.773272, 'lng': 37.646354, 'description': None, 'raw': 'Москва, Маши Порываевой, 7', 'metro': {'station_name': 'Комсомольская', 'line_name': 'Кольцевая', 'station_id': '5.55', 'line_id': '5', 'lat': 55.775672, 'lng': 37.654772}, 'metro_stations': [{'station_name': 'Комсомольская', 'line_name': 'Кольцевая', 'station_id': '5.55', 'line_id': '5', 'lat': 55.775672, 'lng': 37.654772}], 'id': '87873'}",Альфа-Банк,"{'requirement': 'аппарата (теория вероятностей, математика, статистика, эконометрика). - Уверенное знание методов <highlighttext>ML</highlighttext> и умение работать с большими объемами данных. - Понимание основных концепций...', 'responsibility': 'Вакансия в Управлении развития Казначейства. Позиция предполагает функциональное управление процессом и сотрудниками (команды в прямом подчинении нет). Задачи Управления: - Разработка...'}",Полный день,,False,"BI-аналитик, аналитик данных",От 3 до 6 лет,Полная занятость,[],,,,102
False,ML engineer,,False,False,Москва,,USETECH,"{'requirement': 'Необходимы опыт и знания OpenCV, прямо чтобы не менее 5 проектов было. ну или не мене 3 лет разработки на...', 'responsibility': 'Обработка изображений middle/middle+. Распознавание линий электропередач.'}",Полный день,,False,"Программист, разработчик",От 3 до 6 лет,Полная занятость,[],,,,692
False,ML engineer NLP (middle/senior),,False,False,Нижний Новгород,,Группа IT-компаний Lad,"{'requirement': 'Уверенный уровень знания python и основных библиотек анализа данных, применение pytests в работе. 2+ лет опыта NLP (ассистенты, чат...', 'responsibility': 'Разработка чат-ботов на базе LLM. Применение NLP алгоритмов в задачах матчинга, поиска, выделения сущностей. Prompt engineering. Оптимизация базы знаний...'}",Удаленная работа,,False,"Программист, разработчик",От 3 до 6 лет,Полная занятость,[],,,,197
False,DWH Engineer в VK Видео,VK,False,False,Москва,"{'city': 'Москва', 'street': 'Ленинградский проспект', 'building': '39с79', 'lat': 55.796931, 'lng': 37.537847, 'description': None, 'raw': 'Москва, Ленинградский проспект, 39с79', 'metro': {'station_name': 'Аэропорт', 'line_name': 'Замоскворецкая', 'station_id': '2.12', 'line_id': '2', 'lat': 55.800441, 'lng': 37.530477}, 'metro_stations': [{'station_name': 'Аэропорт', 'line_name': 'Замоскворецкая', 'station_id': '2.12', 'line_id': '2', 'lat': 55.800441, 'lng': 37.530477}], 'id': '1926935'}",VK,"{'requirement': 'Умеете работать с Git и разрабатывать код в команде из нескольких человек. Знаете основы работы с операционными системами на базе...', 'responsibility': 'Разрабатывать и поддерживать процессы по обработке и поставке данных для команд аналитики и <highlighttext>ML</highlighttext>. Выявлять и собирать требования к существующим...'}",Полный день,,False,Дата-сайентист,От 3 до 6 лет,Полная занятость,"['Hadoop', 'Apache Airflow', 'Spark', 'Clickhouse']",,,,439
